{
  "schema_version": "1.0.0",
  "policy_version": "study-modeling-policy-1.3.0",
  "effective_release": "private-sector-study-1.51.0",
  "principles": [
    { "code": "observations_first", "rule": "Search already-public sources for direct observations before constructing a modeled synthesis." },
    { "code": "auditable_search_exhaustion", "rule": "Before using residual-gap modeling, document the project-specific public source families searched, record or query identifiers where available, review date or date range, and material negative findings for each unsupported contribution category." },
    { "code": "completion_not_modeling_target", "rule": "Completed-account status is an outcome of supported evidence and eligible synthesis, not a target. Do not create or retain a model merely to populate a missing category or pass the completeness gate." },
    { "code": "preserve_projections", "rule": "Preserve source projections separately and never relabel them as modeled or realized values." },
    { "code": "eligibility_threshold", "rule": "Model only decision-relevant metrics with cited inputs, a reproducible formula, defensible scope, and disclosed uncertainty." },
    { "code": "residual_gap_fallback", "rule": "When modeling eligibility is not met, document the unresolved evidence gap and analytical limit rather than manufacturing a value or requesting nonpublic data." },
    { "code": "no_external_requests", "rule": "Do not send public-records requests, private data requests, surveys, questionnaires, or other solicitations; use already-public evidence and reproducible modeled synthesis only." },
    { "code": "allocation_required", "rule": "Never infer facility values from county, company, campus, utility, or multi-county totals without an explicit allocation model." },
    { "code": "publication_separation", "rule": "Exclude modeled outputs from sourced-record counts, canonical claims, and realized-benefit totals." },
    { "code": "symmetric_evidence", "rule": "Apply identical evidence and uncertainty rules to benefits and costs." },
    { "code": "contribution_not_causation", "rule": "Keep contribution estimates distinct from causal effects." },
    { "code": "fiscal_scope_alignment", "rule": "Do not calculate a net fiscal position from revenues, incentives, or costs that differ in government level, recipient scope, accounting basis, or time horizon." },
    { "code": "fiscal_cost_evidence", "rule": "Do not infer public-service cost as an arbitrary share of project revenue. When same-scope marginal cost is unavailable, publish the recurring tax contribution and its cost break-even threshold without asserting a net fiscal result." },
    { "code": "construction_basis_alignment", "rule": "Apply construction multipliers only to construction-eligible spending; broad capital totals require an explicit equipment-exclusion sensitivity." },
    { "code": "comparison_not_effect", "rule": "Do not label a descriptive or mechanically matched county comparison as a facility effect or causal estimate." },
    { "code": "multiplier_provenance", "rule": "Multiplier models require a named source, model and version, geography, vintage, local-purchase assumption, and separated direct, indirect, and induced channels." },
    { "code": "no_double_counting", "rule": "Do not sum overlapping modeled outputs, source observations, projections, contribution channels, or nested totals." },
    { "code": "strategic_scope", "rule": "Keep national-security narratives outside local economic totals unless a sourced quantitative model defines the local channel and scope." }
  ],
  "eligibility": {
    "direct_observation_search_required": true,
    "source_projection_preservation_required": true,
    "decision_relevance_required": true,
    "cited_inputs_required": true,
    "reproducible_formula_required": true,
    "defensible_scope_required": true,
    "uncertainty_disclosure_required": true,
    "fallback": "documented_unmodeled_gap"
  },
  "source_policy": {
    "evidence_access": "already_public_only",
    "public_records_requests": "prohibited",
    "private_data_requests": "prohibited",
    "surveys_and_questionnaires": "prohibited",
    "residual_gap_treatment": "model_if_eligible_otherwise_document_limit"
  },
  "publication_controls": {
    "canonical_claims": "exclude_modeled_syntheses",
    "source_record_counts": "exclude_modeled_syntheses",
    "realized_benefit_totals": "exclude_modeled_syntheses",
    "presentation": "modeled_not_observed_or_audited"
  },
  "multiplier_requirements": ["source_id", "model_name", "model_version", "geography", "vintage", "local_purchase_assumption", "channel_separation"],
  "causal_requirements": ["treatment_timing", "comparison_design", "outcome_definition", "pre_period", "post_period", "diagnostics", "limitations"],
  "aggregation_controls": {
    "component_membership": "one_aggregation_id_per_estimate",
    "total_components": "explicit_estimate_ids",
    "source_model_separation": "source_claims_are_inputs_not_components",
    "overlap_rule": "no_component_in_multiple_totals_within_aggregation"
  }
}
